{
  "$schema": "http://json-schema.org/draft-07/schema#",
  "$id": "https://harness.internal/schemas/tool-registry.schema.json",
  "title": "Tool Registry Contract Schema",
  "description": "SSOT for ALL tools (built-in + MCP). Every side-effect tool must have an entry (C3, D7). Tools is an object map keyed by tool name.",
  "type": "object",
  "required": ["schema_version", "tools"],
  "properties": {
    "schema_version": { "type": "string", "pattern": "^\\d+\\.\\d+\\.\\d+$" },
    "description": { "type": "string" },
    "generated_at": { "type": "string" },
    "tools": {
      "type": "object",
      "description": "Map of tool name → tool definition",
      "additionalProperties": {
        "type": "object",
        "required": ["surface", "side_effect", "risk_level", "allowed_roles"],
        "properties": {
          "surface": {
            "type": "string",
            "description": "Where the tool lives. 'virtual' is a marker with no executor behind it — it exists so a stage can be authorized to record an outcome (e.g. a QA verdict) without being handed a real side-effect tool to do it.",
            "enum": ["builtin", "mcp", "virtual"]
          },
          "side_effect": { "type": "boolean" },
          "risk_level": { "type": "string", "enum": ["none", "low", "medium", "high", "critical"] },
          "allowed_roles": { "type": "array", "items": { "type": "string" } },
          "default_action": { "type": "string", "enum": ["allow", "ask", "deny"] },
          "unless_in_workflow": { "type": "boolean" },
          "idempotency_key_pattern": { "type": "string" },
          "idempotency_note": {
            "type": "string",
            "description": "When the key does NOT mean 'replaying this is safe'. `deploy` pulls whatever is at HEAD, so two identical calls can deploy different code; `rollback_deploy` reverts the newest commit each time, so a repeat reverts the revert. The key answers 'did this operation already run', not 'will the result be the same' — where those differ, say so here rather than letting a reader assume the stronger claim."
          },
          "input_contract": {
            "type": "string",
            "description": "The tool's accepted input, as a compact type sketch (e.g. \"{ server_id: string, app_id: string, skip_build?: bool }\"). Read by the Portal's H2-1 check together with output_contract. Must describe the fields the tool ACTUALLY takes: an idempotency_key_pattern over field names that do not exist cannot be computed, and this field is what makes that mismatch visible."
          },
          "output_contract": {
            "type": "string",
            "description": "What a successful call returns, same compact sketch. Half of H2-1 — a declared input with no declared output leaves the caller guessing what to branch on."
          },
          "error_contract": {
            "type": "string",
            "description": "The failure modes a caller must handle, pipe-separated (e.g. \"timeout | non_zero_exit | denied_by_guard\"). The H2-1 criterion text asks for input/output/ERROR types; this is the third one. Not read by the current check — declared because a caller that only knows the happy path handles failure by ignoring it."
          },
          "contract_source": {
            "type": "string",
            "description": "Where the contract came from, so a reader can weigh it (C13 — provenance travels with the value). `mcp-schema` / `builtin-schema` = copied from the live tool schema. `registry-description` = derived from this file's own prose because no schema was available; treat as unverified.",
            "enum": ["mcp-schema", "builtin-schema", "repo-script", "registry-description"]
          },
          "contract_note": {
            "type": "string",
            "description": "Anything a reader needs before trusting the contract — most usefully, that the tool is registered here but NOT exposed by the live MCP server, which means nothing has ever validated the shape."
          },
          "description": { "type": "string" },
          "enforcing_script": { "type": "string" },
          "timeout_seconds": {
            "type": "integer",
            "minimum": 1,
            "description": "Wall-clock ceiling for one call. Spelled to match its only reader: the Portal's H4-4 check accepts a high/critical tool that declares `timeout_seconds` OR `sandbox_required`, so an entry that says `timeout` or `timeout_ms` instead reads as undeclared. DECLARATIVE — nothing in this bundle kills a call that overruns; the executor or the gateway does, and until one of them reads this the field is a statement of intent, not a bound.",
            "examples": [30, 300]
          },
          "sandbox_required": {
            "type": "boolean",
            "description": "This tool may only run inside an isolated execution context. Same reader and same caveat as timeout_seconds: declaring it does not create the sandbox. It is worth declaring anyway — it turns 'we never decided' into an auditable 'required but not yet enforced'.",
            "examples": [true]
          },
          "rate_limit": {
            "type": "object",
            "description": "Per-tool call ceiling. NOT where the H2-4 scorer looks — that reads the fleet-wide `tool.rate_limits` map in .harness/control/casan-policies.yaml, which uses per_minute/per_hour keys. This is the per-entry declaration a gateway can enforce next to the tool it governs; nothing cross-checks the two, so keep them in agreement yourself.",
            "required": ["calls", "per_seconds"],
            "properties": {
              "calls": { "type": "integer", "minimum": 1, "description": "Calls permitted inside one window." },
              "per_seconds": { "type": "integer", "minimum": 1, "description": "Window length in seconds. Required next to `calls` because a count with no window is not a limit anyone can enforce." }
            }
          },
          "retry": {
            "type": "object",
            "description": "What a caller may do when this tool fails. DECLARATIVE — no harness script retries on your behalf; this tells whoever does (gateway, workflow runner) where to stop. Retrying a side-effect tool safely also needs idempotency_key_pattern above, or the retry duplicates the effect instead of repeating the attempt.",
            "required": ["max_attempts"],
            "properties": {
              "max_attempts": { "type": "integer", "minimum": 1, "description": "Total attempts including the first (1 = do not retry). Required inside `retry` because a backoff with no ceiling is exactly the unbounded loop H2-4 exists to prevent." },
              "backoff_seconds": { "type": "integer", "minimum": 0, "description": "Delay between attempts." },
              "retry_on": {
                "type": "array",
                "items": { "type": "string", "minLength": 1 },
                "description": "Failure classes worth retrying, e.g. \"timeout\", \"http_5xx\". Left open instead of enumerated: the useful values are provider-specific error names, and a closed list here would reject the ones a project actually sees.",
                "examples": [["timeout", "http_5xx"]]
              }
            }
          }
        },
        "if": { "properties": { "surface": { "const": "virtual" } }, "required": ["surface"] },
        "then": {
          "description": "A virtual tool that could claim a side-effect would defeat its own purpose: the registry is what tells the guard which calls are dangerous, so a marker must be provably harmless or it becomes a hole to smuggle real actions through.",
          "properties": {
            "side_effect": { "const": false },
            "risk_level": { "const": "none" }
          }
        }
      }
    }
  }
}
