{
  "$schema": "https://harness.internal/schemas/tool-registry.schema.json",
  "schema_version": "1.0.0",
  "description": "SSOT for ALL tools (built-in + codeprovider-mcp). Entries are maintained HERE; contract fields (input/output/error/idempotency) are merged from contracts/tool-contracts.yaml by tools/harness-registry/apply-contracts.py. This file is NOT generated from contracts/tool-registry.yaml -- that file is a partial, older subset (20 of these tools).",
  "generated_at": "2026-07-09T00:00:00Z",
  "tools": {
    "Read": {
      "surface": "builtin",
      "side_effect": false,
      "risk_level": "none",
      "allowed_roles": [
        "developer",
        "reviewer",
        "admin"
      ],
      "default_action": "allow",
      "description": "Read file contents",
      "input_contract": "{ file_path: string(absolute), offset?: int, limit?: int, pages?: string }",
      "output_contract": "{ content: string(cat -n format), truncated?: bool }",
      "error_contract": "not_found | is_directory | empty_file | permission_denied",
      "contract_source": "builtin-schema"
    },
    "Glob": {
      "surface": "builtin",
      "side_effect": false,
      "risk_level": "none",
      "allowed_roles": [
        "developer",
        "reviewer",
        "admin"
      ],
      "default_action": "allow",
      "description": "Fast file pattern matching",
      "input_contract": "{ pattern: string(glob), path?: string(dir) }",
      "output_contract": "{ paths: string[] (sorted by mtime) }",
      "error_contract": "invalid_pattern | path_not_a_directory",
      "contract_source": "builtin-schema"
    },
    "Grep": {
      "surface": "builtin",
      "side_effect": false,
      "risk_level": "none",
      "allowed_roles": [
        "developer",
        "reviewer",
        "admin"
      ],
      "default_action": "allow",
      "description": "Content search",
      "input_contract": "{ pattern: string(regex), path?: string, glob?: string, type?: string, output_mode?: content|files_with_matches|count, -i?: bool, -n?: bool, -o?: bool, -A?: int, -B?: int, -C?: int, context?: int, multiline?: bool, head_limit?: int, offset?: int }",
      "output_contract": "{ matches: string[] } | { files: string[] } | { counts: map<string,int> }",
      "error_contract": "invalid_regex | path_not_found",
      "contract_source": "builtin-schema"
    },
    "WebSearch": {
      "surface": "builtin",
      "side_effect": false,
      "risk_level": "low",
      "allowed_roles": [
        "developer",
        "admin"
      ],
      "default_action": "allow",
      "description": "Web search",
      "input_contract": "{ query: string, allowed_domains?: string[], blocked_domains?: string[] }",
      "output_contract": "{ results: [{ title, url, snippet }] }",
      "error_contract": "network_error | rate_limited | no_results",
      "contract_source": "builtin-schema"
    },
    "WebFetch": {
      "surface": "builtin",
      "side_effect": false,
      "risk_level": "low",
      "allowed_roles": [
        "developer",
        "admin"
      ],
      "default_action": "allow",
      "description": "Fetch web content",
      "input_contract": "{ url: string, prompt: string }",
      "output_contract": "{ content: string(extracted) }",
      "error_contract": "network_error | http_error | robots_denied | too_large",
      "contract_source": "builtin-schema"
    },
    "Write": {
      "surface": "builtin",
      "side_effect": true,
      "risk_level": "medium",
      "allowed_roles": [
        "developer",
        "admin"
      ],
      "default_action": "allow",
      "idempotency_key_pattern": "write:{file_path}:sha256({content})",
      "description": "Write file contents",
      "input_contract": "{ file_path: string(absolute), content: string }",
      "output_contract": "{ written: bool, path: string }",
      "error_contract": "not_read_first(overwrite guard) | permission_denied | path_is_directory",
      "idempotency_note": "Same path + same content is a true no-op; same path + different content is a DIFFERENT operation and must not dedupe.",
      "contract_source": "builtin-schema"
    },
    "Edit": {
      "surface": "builtin",
      "side_effect": true,
      "risk_level": "medium",
      "allowed_roles": [
        "developer",
        "admin"
      ],
      "default_action": "allow",
      "idempotency_key_pattern": "edit:{file_path}:sha256({old_string}|{new_string})",
      "description": "Edit file with string replacement",
      "input_contract": "{ file_path: string(absolute), old_string: string, new_string: string, replace_all?: bool }",
      "output_contract": "{ replaced: int, path: string }",
      "error_contract": "file_not_read_first | old_string_not_found | old_string_not_unique | no_change",
      "idempotency_note": "Not replayable by design: after a successful edit old_string no longer matches, so a repeat fails loudly rather than double-applying.",
      "contract_source": "builtin-schema"
    },
    "Bash": {
      "surface": "builtin",
      "side_effect": true,
      "risk_level": "medium",
      "allowed_roles": [
        "developer",
        "admin"
      ],
      "default_action": "ask",
      "idempotency_key_pattern": "bash:sha256({command})",
      "enforcing_script": "harness-runtime-guard.ps1",
      "description": "Execute bash command",
      "input_contract": "{ command: string, timeout?: int(ms, max 600000), run_in_background?: bool, dangerouslyDisableSandbox?: bool, description?: string }",
      "output_contract": "{ stdout: string, stderr: string, exit_code: int }",
      "error_contract": "timeout | non_zero_exit | denied_by_guard | interactive_prompt_blocked",
      "idempotency_note": "A shell command's safety on replay is unknowable from its text; the key detects the repeat and hands the decision to a human.",
      "contract_source": "builtin-schema",
      "contract_note": "`dangerouslyDisableSandbox` was missing from the first version. It is the only input on this tool that changes what the call is ALLOWED to touch — omitting it from the contract hides the one field a reviewer would look for."
    },
    "PowerShell": {
      "surface": "builtin",
      "side_effect": true,
      "risk_level": "medium",
      "allowed_roles": [
        "developer",
        "admin"
      ],
      "default_action": "ask",
      "idempotency_key_pattern": "pwsh:sha256({command})",
      "enforcing_script": "harness-runtime-guard.ps1",
      "description": "Execute PowerShell command",
      "input_contract": "{ command: string, timeout?: int(ms, max 600000), run_in_background?: bool, dangerouslyDisableSandbox?: bool, description?: string }",
      "output_contract": "{ stdout: string, stderr: string, exit_code: int }",
      "error_contract": "timeout | non_zero_exit | denied_by_guard | parse_error",
      "idempotency_note": "Same reasoning as Bash.",
      "contract_source": "builtin-schema"
    },
    "Agent": {
      "surface": "builtin",
      "side_effect": false,
      "risk_level": "low",
      "allowed_roles": [
        "developer",
        "admin"
      ],
      "default_action": "allow",
      "description": "Spawn subagent",
      "input_contract": "{ description: string, prompt: string, subagent_type?: string, model?: sonnet|opus|haiku|fable, isolation?: worktree|remote, run_in_background?: bool }",
      "output_contract": "{ agent_id: string, final_text: string }",
      "error_contract": "unknown_subagent_type | agent_died | budget_exhausted",
      "idempotency_key_pattern": "agent:{subagent_type}:sha256({prompt})",
      "idempotency_note": "An agent run is non-deterministic; the key catches an accidental duplicate dispatch, not an equivalent result.",
      "contract_source": "builtin-schema",
      "contract_note": "`model` is an ENUM, not a free string — writing it as `string` threw away the one place this registry could have expressed the C4 model ladder as a machine-checkable constraint."
    },
    "Workflow": {
      "surface": "builtin",
      "side_effect": false,
      "risk_level": "low",
      "allowed_roles": [
        "developer",
        "admin"
      ],
      "default_action": "allow",
      "description": "Execute workflow script",
      "input_contract": "{ script?: string, scriptPath?: string, name?: string, args?: any, resumeFromRunId?: string }",
      "output_contract": "{ runId: string, result: any, transcriptDir: string }",
      "error_contract": "script_syntax_error | unknown_workflow_name | agent_cap_exceeded | budget_exhausted",
      "idempotency_key_pattern": "workflow:{name|scriptPath}:sha256({args})",
      "contract_source": "builtin-schema"
    },
    "harness-switch-account": {
      "surface": "builtin",
      "side_effect": true,
      "risk_level": "low",
      "allowed_roles": [
        "developer",
        "admin"
      ],
      "default_action": "allow",
      "idempotency_key_pattern": "switch-account:{account}",
      "description": "Switch active-account pointer for per-machine H6 attribution (local file write, no network)",
      "input_contract": "{ account: string(profile name in power-policy) }",
      "output_contract": "{ switched_to: string, previous: string }",
      "error_contract": "unknown_account | credential_missing",
      "idempotency_note": "Switching to the account already active is a genuine no-op.",
      "contract_source": "repo-script"
    },
    "codeprovider-mcp.apply_patch": {
      "surface": "mcp",
      "side_effect": true,
      "risk_level": "medium",
      "allowed_roles": [
        "developer",
        "admin"
      ],
      "default_action": "ask",
      "idempotency_key_pattern": "patch:{server_id}:{app_id}:sha256({patch})",
      "enforcing_script": "harness-runtime-guard.ps1",
      "description": "Apply patch to file",
      "input_contract": "{ server_id: string, app_id: string, patch: string(unified diff with ---/+++/@@), strip?: int=1 }",